Home_Team,Home_Score,Away_Team,Away_Score,Headline,URL,Date,Article
Liverpool,0,United,0,Defiant Manchester United keep Liverpool at arm’s length in stalemate,https://www.theguardian.com/football/2023/dec/17/liverpool-manchester-united-premier-league-match-report,2023-12-17,"Manchester United returned to the scene of the crime and removed all evidence of the spinelessness and unprofessionalism that besmirched their last appearance at Anfield. Erik ten Hag’s team were defiant, disciplined and unified, everything they were not in the 7-0 rout in fact, in taking a point against Liverpool. United made a point, too: the dressing room still plays for its manager. United became the first team to stop Liverpool winning at Anfield this season and the first to prevent Jürgen Klopp’s side scoring since Chelsea held them to a goalless draw in April. Liverpool could have set a club record of scoring in 35 consecutive games in all competitions but, against a defence marshalled expertly by Raphaël Varane, were found wanting here with the final ball or decision. Diogo Dalot’s dismissal for two shows of dissent in quick succession came too late to take advantage. Klopp disliked the pre-match talk of another Liverpool landslide. He feared, correctly as it transpired, that United would be inspired not scarred by their harrowing Anfield experience last season. He liked the outcome even less as Liverpool’s run of 11 successive home wins was halted by a resolute United performance in front of Anfield’s biggest crowd for more than half a century. An extra 7,000 seats were available in the upper tier of the new Anfield Road stand for the first time. There were an extra 7,000 groans of frustration as Liverpool missed the chance to return to the Premier League summit. For Ten Hag, the 212th meeting between the clubs delivered the reaction he required following after United’s meek midweek exit from the Champions League. It could have been perfect had his visitors capitalised on several promising counter‑attacks in the second half – Rasmus Højlund failed to take the best opening of the match – but there was no denying Liverpool’s overall dominance. The United manager was hindered by an injury list that included three central defenders – Harry Maguire, Lisandro Martínez and Victor Lindelöf. Bruno Fernandes’s suspension and the ill Anthony Martial reduced his options further. Even so, the ramshackle nature of United’s starting lineup and inexperience on their bench reinforced how badly the club has recruited at vast expense in recent years. There was a sense of achievement for the visitors in getting to half-time goalless, although their authority increased as Liverpool’s attempts fell flat. Klopp had vowed that Liverpool would “go for them” in an attempt to prey on any lingering anxieties from the record victory last season. He wasn’t lying. Liverpool won the first corner after 26 seconds. There was a tumultuous roar when Ryan Gravenberch pressed Sofyan Amrabat into submission in a United corner. Højlund had to help Luke Shaw at left‑back long before making his presence felt in the Liverpool half. There was intensity and constant pressure from the home side, forcing United into desperate defensive actions from the first whistle, but too many wayward final balls enabled the visitors to ride the storm in the first half. André Onana escaped when dropping a Ryan Gravenberch header under pressure to Mohamed Salah, and reacting to turn his scrambled shot wide, but was only seriously tested by Virgil van Dijk’s header from Trent Alexander-Arnold’s corner. The United keeper tipped over from close range. Onana’s biggest contribution was to the palpitations among the away fans whenever playing out with his feet. The lack of composure in Liverpool’s first-half performance was encapsulated by the first booking of the contest for Darwin Núñez. The Uruguay international raised an arm into the chest of Jonny Evans when pursuing a long ball out of defence and was booked for kicking the ball away after the blatant free-kick was awarded. He then sarcastically applauded the assistant referee. The foul on Evans was more deserving of a yellow card than the offence for which Núñez was cautioned. Dalot’s dismissal for two bookable offences in the same incident, when he rightly argued for a United throw-in, was harsh in comparison. United were reliant on the counterattack to hurt Liverpool. They might have succeeded with more quality, confidence and intelligence in their front line, particularly in the second half when the visitors had ample opportunity to expose Liverpool’s defence. Antony was again infuriatingly wasteful, quicker to blame others for his mistakes than to spot the right pass. The largely anonymous Alejandro Garnacho was played through by a delightful ball from Kobbie Mainoo but unable to hold off Alexander-Arnold as he entered the penalty area. The Liverpool vice-captain intervened with a vital touch. Antony was involved in a flowing United move that ended with Scott McTominay, captain in the absence of Fernandes, releasing Højlund behind Van Dijk. The chance to open his United league account when and where it really mattered presented itself to Højlund but Alisson blocked well with his chest and gathered the follow-up. Klopp’s team continued to pose the greater threat, however. Alexander-Arnold placed a shot inches wide from 25 yards with Onana stranded. The Cameroon international produced an assured second‑half performance, saving confidently from Salah, Ibrahima Konate and Nunez. United also survived a VAR review for handball against Shaw after Kostas Tsimikas’s cross bounced up on to the defender’s arm off his thigh. Dalot made a superb intervention to prevent Luis Díaz sweeping home from close range and, despite losing his cool to reduce United to 10 men, there was no fresh torment for Ten Hag at Anfield. United must build on this foundation."
Brentford,1,Villa,2,Ollie Watkins seals furious comeback win for Aston Villa at Brentford,https://www.theguardian.com/football/2023/dec/17/brentford-aston-villa-premier-league-match-report,2023-12-17,"Having blown open the Premier League title race, can Aston Villa sustain their own challenge? Brentford seemed to have brought Villans’ dreaming to a halt, as Thomas Frank’s team first dulled their attack and then scored through Keane Lewis-Potter. But once reduced to 10 men after Ben Mee’s red card, they could not resist Villa’s surges and self-belief. Aston Villa thus celebrate a first win at Brentford since February 1953, the same week Disney released the original Peter Pan feature-length cartoon. A first Villa title challenge of the 21st century is no fairy story, although this encounter featured x-rated tackles, 10 outfield bookings and three off-field amid repeated heavy aggro, including during the celebrations of Ollie Watkins’s winner against his former club. The game concluded as Boubacar Kamara was dismissed following a ruck started by Emi Martínez’s bundling of Neal Maupay to the floor. Players and coaches piled in. Unai Emery made a beeline for Martínez but did not prevent Kamara’s shove on Yegor Yarmolyuk. “I was trying to calm the players down,” said Villa’s manager, booked for his peacekeeping. “I’m trying to speak with him,” he said of Martínez, the goalkeeper having kept his team in the game. “He had a fantastic match.” Afterwards, Watkins similarly sought to cool waters, explaining his celebration. “It all spurred from my celebration but that’s not down to a lack of respect for the fans,” he said. “I love the club, the players and staff, I’ve not got a bad word to say against them. But there was one person who was abusing me all game.” The suggestion from the Villa camp was the abuser had spoken ill of Watkins’s family. “I know Ollie as a person of top integrity,” Frank said, equally diplomatic. Brentford are racked with injuries with Bryan Mbeumo’s absence until beyond the Africa Cup of Nations a particularly acute problem even if one of Frank’s best assets as a manager is responding to setbacks. He particularly enjoys doing so by beating clubs with eyes on haughtier targets but what looked a likely coup became a fifth defeat in six. “They gave everything,” he said of his team. Taking a dim view of the scenes at the end, he criticised his players though was clearly equally unhappy with Villa’s behaviour. “But it’s important we show class.” Until Mee’s dismissal the signs were that Villa, for all this season’s advancements, lack strength in depth. Leon Bailey, outstanding in keynote defeats of both Manchester City and Arsenal and eventually key to victory, was fit only for the bench and two previous ever-presents in Douglas Luiz and Lucas Digne were serving suspensions. From the kick-off Brentford, no slouches in pressing, were confined to their defensive third. Still, that left space for counterattacks and it took Martínez’s brilliant reaction save from Mikkel Damsgaard to prevent an early Bees lead. Brentford had a penalty shout declined when John McGinn appeared to wrench Mee to the floor in an act of Glaswegian affection that foreshadowed the later ugly scenes. “I thought there were three mistakes today,” Frank said. “Sometimes you feel unfairly treated but you have to move forward.” In the stands, sat with his fellow absentee Rico Henry, Ivan Toney doubtless wondered what hay he could make from a Villa defence offering much with which to work. Away from home, Villa’s mistakes have been far more prevalent – and costly – than at fortress Villa Park. On the stroke of half-time, Lewis-Potter took full advantage of such slackness. The ball bounced variously from the orbits of Kamara, Watkins and a flailing Álex Moreno before the former Hull player waited for Saman Ghoddos’s corner to score a first Premier League goal. Villa began the second half beating at the door of a retrenched Brentford, Emery twisting himself in knots on the touchline. It took Mee’s dismissal to turn the game Villa’s way. A high tackle on Bailey was both a tactical foul to stop the forward escaping and a rake of the Jamaican’s shins. Mee made himself ready to depart as soon as the referee, David Coote, was called to the video screen. Frank asked: “Do we want a physical contact sport or not?” His mood turned yet more purple when the substitute Maupay was baulked by Ezri Konsa and yet neither Coote nor the VAR, Craig Pawson, deemed that worthy of a penalty. Soon enough Bailey helped to bring Villa level, finding Moreno at the back post, and tensions began to brim over – Frank taking particular exception to Austin MacPhee, Villa’s lank-locked set-piece coach. That it was a corner that brought Villa their late winner probably only added to Frank’s agitation. Jacob Ramsey took it, and Kamara’s back-heel found Watkins to nod in and celebrate in the uncharacteristic goading fashion he later had to explain. Villa’s impossible dream endures, though they lived on their nerves to keep it that way."
West Ham,3,Wolves,0,Mohammed Kudus magic silences Wolves as West Ham find home comfort,https://www.theguardian.com/football/2023/dec/17/west-ham-wolves-premier-league-match-report,2023-12-17,"The stadium announcer described him before kick‑off as a “wizard” and Mohammed Kudus certainly has magic in his boots at the moment. Two goals in the space of 10 first‑half minutes from the Ghana forward inspired West Ham to a fourth successive home victory that leaves David Moyes’s side clutching the coat-tails of the Premier League’s top six. Kudus, who joined from Ajax in the summer for £38m, now has nine goals for West Ham including four in his past three appearances here at a stadium quickly becoming his spiritual home. The only issue for Moyes will be how to replace him next month during the Africa Cup of Nations. “It’s a huge blow for us – he is great to work with,” the West Ham manager said. “He scores goals and makes goals and he’s doing all the work for us as well. We are going to have to find other ways. We’ll hugely miss him.” Gary O’Neil’s battling Wolves team were denied a goal by the finest of margins courtesy of VAR but they were no match for Kudus and his co‑tormentor Lucas Paquetá, who provided assists for both opening goals and set up Jarrod Bowen’s clincher with 16 minutes to play. “It’s great credit to our forward players – that’s what Lucas Paquetá can do for us,” Moyes said. “I’m pulling my hair out half the time and the other half I’m celebrating because he’s making passes that a lot of people can’t see.” While West Ham’s victory against Freiburg on Thursday was their 10th successive home win in European competition, things have not been so straightforward in the Premier League this season. Before this game, Moyes’s team had picked up more points on the road despite the 5-0 hammering at Fulham last weekend and started here like they intended to consign that performance to history. Dan Bentley – brought in to replace José Sá in the Wolves goal with the usual No 1 nursing a shoulder injury – survived an aerial bombardment inside the first 10 minutes courtesy of some pinpoint deliveries from James Ward-Prowse and Bowen. Wolves showed a glimpse of their threat on the break when Matheus Cunha forced Lukasz Fabianski into a simple save and almost took the lead 15 seconds before Kudus found the breakthrough at the other end. Craig Dawson’s header from a corner was going just wide but still needed Emerson to deal with the danger, with Edson Álvarez finding Paquetá in space before Kudus did the rest after cutting inside on to his favoured left foot. It was a stunning strike that left Bentley grasping at thin air. Fabianksi was at full stretch to save another effort from Cunha as Wolves attempted to strike back but the visitors soon found themselves two goals down. Kurt Zouma intercepted a pass from Mario Lemina and once again it was Paquetá’s vision that opened the door to allow Kudus to finish with aplomb, this time with his right foot. “We were nowhere near good enough,” said O’Neil, who blamed the defeat on “disastrous decision‑making” for West Ham’s opening two goals. “Hopefully when we get a few more players back we will give a better account of ourselves.” Wolves had found the net in every match this campaign since their controversial defeat against Manchester United on the opening weekend but could not find a way back into the game this time. They could have been three down at the break had Bowen’s shot not smacked off the post moments after the West Ham forward felt he had been brought down in the area. Emotions momentarily got the better of O’Neil just before half-time when he was booked after protesting when Vladimir Coufal was not sanctioned for seeming to use his forearm in a heavy challenge on Jean-Ricner Bellegarde. “Over the course of the game I thought his challenges warranted two yellows and the fact he wasn’t booked for that challenge was strange,” the Wolves manager insisted. O’Neil was back prowling the touchline at the start of the second half in the hope of rousing a comeback from his team, with Tomas Soucek blocking a goalbound shot from Hwang Hee-chan. The lifeline they craved seemed to arrive when Pablo Sarabia touched home a cross from Nélson Semedo but after a long delay VAR deemed the Spaniard to be marginally offside. O’Neil could barely believe his bad luck. Another Cunha shot whistled over the crossbar from a tight angle but the game was up when Bowen picked up the ball in his own half and played a one-two with Paquetá. Suddenly the West Ham forward found himself in acres of space and there was only ever going to be one outcome as he slid the ball past Bentley to seal a comfortable win for the hosts before Kudus and Paquetá left the field to a richly deserved standing ovation."
Arsenal,2,Brighton,0,Kai Havertz and Gabriel Jesus deliver goods as Arsenal sink Brighton to go top,https://www.theguardian.com/football/2023/dec/17/arsenal-brighton-premier-league-match-report,2023-12-17,"At the end of this controlled, arm’s-length victory against a defanged Brighton there was a sense once again of this Arsenal team operating in a kind of stealth mode. Defeat against Brighton here in May had effectively ended Arsenal’s hopes of winning the league last season. This time around second‑half goals from Gabriel Jesus and Kai Havertz lifted Mikel Arteta’s team back to the top of the table. Afterwards Arteta spoke about things like maturity and game intelligence. Roberto De Zerbi was more effusive: “Arsenal are the best team we have played so far this season. We are not used to suffering in this way. We are used to controlling the game.” Control is the key word. There has been a less emotionally draining pitch about Arsenal’s progress so far this year after the adrenal highs of last season, the talk of collapse, of being, of all things, “too emotional” in the final knockings (never mind losing your best defender or being reeled in by one of the great club teams: emotion is definitely a better story). Even the celebrations at the end here were relatively contained, Martin Ødegaard restricting himself to a rather mannered fist-pump toward the home end. Sporting narrative is always entirely outcome-based. This kind of victory will either become evidence of a team ready to win titles or evidence of a team still looking for fluency. Take your pick and count backwards from the end. For now Arteta and his players will be delighted with the routine, energy-saver feel of a 12th league victory of the season. This is a relatively novel fixture, to the extent Arteta has been on the touchline for more than a third of all Arsenal versus Brighton games ever. Even in that limited time Brighton have still been able to attain mild bogey-team status, although here they always looked to be feeling the burn from their Europa League win against Marseille on Thursday. The key moment arrived just after half-time, as Arsenal re-emerged predictably geed up after dominating territory and possession without any real sense of devil. Havertz and Ødegaard pushed higher up the pitch. Suddenly there were overlaps and half-chances. But the opening goal still came from the latest in a series of knife-edge Brighton passing moves inside their own box. Jack Hinshelwood won the ball back from Bukayo Saka deep on the right flank. At which point the Brighton defence enacted a startlingly intricate passing zigzag across the penalty area, no doubt with the intention of sucking Arsenal in, avoiding the counter-press and so on, but they were hurried and harried and ended up conceding a needless corner. Saka took it. The ball swung violently in towards goal and flicked off the top of Jan Paul van Hecke’s head. Unmarked, Jesus stooped to nod it into the net. From there Arsenal were able to sit a little deeper. Declan Rice controlled the angles in midfield. Ødegaard had a fine game and produced the pass of the afternoon in the first half, a stunned, back-spun, curving piece of stage direction, eased into the tiniest channel of space to put Saka in on goal, only for Gabriel Martinelli to scoop the cut‑back over the bar. The Emirates Stadium had been a chilly, drab, Sunday-ish place at kick‑off. Arsenal were unchanged from the defeat at Villa Park last weekend. De Zerbi was forced to persist with James Milner at left‑back. It took 50 seconds for Saka to engineer his first odd-couple duel down that flank, although to Milner’s credit he battled away all afternoon, an act of will as opposed to any great defensive technique, whirling about staunching the danger like a tugboat captain in a storm. Arsenal had control without penetration in the first half, Rice easing about like a triple-masted galleon in midfield. The only real incident of note involved Arteta himself. Fresh from walking away a free man on the steps of the highest VAR court in the land, he was booked just before half-time for another moment of sideline rage. Kaoru Mitoma had pulled Saka back. Arteta responded by leaping about weirdly with both hands in the air, like a man on a desert island spying a sail just as it fades over the horizon. It seemed pointless and performative. The foul had been given. There was no logical reason to go full touchline-disco. Brighton did have their chances. Pascal Gross might have equalised 10 minutes before the end but poked his shot wide from four yards out. Moments later Havertz sealed the game with a fine finish after another rapier break down the left flank. Havertz had spent much of the autumn running on sympathy and pity-penalties. Here he picked up Arsenal’s player of the month award before kick-off, posing a little awkwardly with the trophy (unless specifically stated otherwise Havertz is always doing things a little awkwardly. This is a footballer who can win the Champions League a little awkwardly). The goal was his fourth in the past four weeks, the victory Arsenal’s seventh in nine since defeat at Newcastle."
Burnley,0,Everton,2,Everton pile misery on Burnley as old boy Michael Keane caps off win,https://www.theguardian.com/football/2023/dec/16/burnley-everton-premier-league-match-report,2023-12-16,"Turf Moor has witnessed this template for victory by a Sean Dyche team dozens of times but unfortunately for Burnley he is not their manager any more. Everton were organised, physically dominant and enjoyed goals from players over 6ft to secure a fourth straight victory without conceding, to place them seven points clear of the relegation zone, despite their 10-point deduction, as the siege mentality continues to grow. Amadou Onana and Michael Keane settled the result on a night of nostalgia for Burnley fans, but it was never in doubt as Everton provided 90 minutes of know-how and effective football, while Burnley’s naivety was laid bare by the man with a pub named after him around the corner. In normal circumstances, Everton would sit ninth, an indication of the turnaround under Dyche over the past 11 months. “There is a lot of work to be done because of the penalty,” Dyche said. “I am very pleased with the players’ attitude towards it. You have to find ways of winning games and I think that is an improvement with their understanding.” No one needed to be told who had left the tunnel when the roar went up. Dyche was striding across the pitch for the umpteenth time of his managerial career but for the first time since his final home game as Burnley manager, a 3-2 victory over Everton in April 2022, after almost 10 years in Lancashire. “I had a fantastic time here and if I paid my bit back, that’s how it should be. It is nice to enjoy that moment,” he said. “It was a rare one where the manager gets respect, hopefully from the Evertonians, but the Burnley fans as well.” The opening goal was pure Dyche as the former Claret Dwight McNeil swung a corner to the back post where Onana produced a towering header as James Trafford flapped. For all of Burnley’s nice ideas in possession, Everton were showing efficiency is more effective. It was nostalgic viewing for the home supporters as they got to witness a highly disciplined team with James Tarkowski and Keane at centre-back. The two combined for Everton’s second as the former headed a free-kick down to the latter on the edge of the box; Keane’s first shot was blocked by Trafford but ricocheted back into the defender’s path off Dara O’Shea, allowing him to tap home from six yards. Two assists and a goal for the old boys will not have cheered the fans of the Premier League’s second-bottom club. “There is not much I can say about the overall defending or attacking, it is about both boxes today,” Vincent Kompany said. “We conceded two set plays and the moments we had, we were not able to finalise anything. Getting done in both boxes is what you are left to discuss. It is a credit to Everton, they are one of the best in the league [at set pieces].” Inspired by Lyle Foster’s return for his first appearance in almost two months, after being given time off to deal with mental-health issues, Burnley were more energetic after the break. They looked dangerous on both flanks to cause Everton problems and eventually forced a save when Zeki Amdouni rifled a shot from distance towards the top corner, Jordan Pickford tipping it wide. Dyche was happy to let Burnley pass the ball around because he was confident they did not have the ability to penetrate his back five and he was proved right. It was Everton’s eighth victory of the season where they have had the minority of possession, while Burnley succumbed to their eighth home defeat. Dyche showed once again why he is the king of Turf Moor to make it a night of dejection in the Royal Dyche."
