Home_Team,Home_Score,Away_Team,Away_Score,Headline,URL,Date,Article
Villa,4,West Ham,1,Douglas Luiz shines as Aston Villa see off West Ham with a flourish to go fifth,https://www.theguardian.com/football/2023/oct/22/aston-villa-west-ham-premier-league-match-report,2023-10-22,"Unai Emery can celebrate his first anniversary in charge of Aston Villa on Tuesday safe in the knowledge that he has turned his team into contenders to be considered among the best of the rest. Only Manchester City – the champions and leaders – Arsenal and Liverpool have gained more wins over this period and, with Douglas Luiz continuing his unlikely conversion into a prolific goalscoring midfielder, Villa sashayed to within two points of the top. Only Newcastle have scored more Premier League goals than Villa this autumn as they dismissed West Ham with a stylish display to reach 19 points, their best tally after nine games for 25 years. With five places in the Champions League likely to be available to the Premier League from this season, Villa could stay in the argument, though Emery is keeping a lid on his club’s ambitions. “One of our dreams is to be with the top seven teams and to do something in Europe,” he said, adding the names of Newcastle, Chelsea and Manchester United to those clubs currently above Villa, while reiterating his desire to win the Champions League one day. “To get European football is very important and that is the work we need to try to do. We need to be consistent in what we are doing.” It is difficult to avoid being swamped by the sheer torrent of numbers confirming Villa’s renaissance under Emery but somehow he has supplemented a discontented ensemble of decent players and turned his squad into a fluid and entertaining side with a solid backbone. The atmosphere at a sold-out Villa Park was vibrant, passionate and, after some dull times, grateful. Not since Dwight Yorke scored in eight successive top-flight home games in 1991 have Villa had such a prolific homebird as Douglas Luiz. Not bad for a holding midfielder whom Steven Gerrard was willing to offload last year. Backed by Boubacar Kamara in the heart of the midfield, Douglas Luiz has been granted more licence to support the attack alongside John McGinn, Moussa Diaby and, recalled here as Villa reverted to a four-man defence, Nicolò Zaniolo. Douglas Luiz was typecast as a defensive midfield pivot in his early days at Villa Park, and was strongly linked with a move to Arsenal when sidelined, but Emery has unshackled the more complete player. Villa and West Ham head off on European trips on Thursday but it is the Midlands club, winning their 11th successive top-flight game at home, who look far more ready on this evidence to stay competing for European qualification through the Premier League. They were superior for all but the 15 minutes after Douglas Luiz’s second goal made it 2-0 and it will be their supporters raising a glass of claret while the Hammers fans head back to London feeling blue. For the deserved breakthrough, Zaniolo played a neat ball back inside the penalty area for Ollie Watkins to tee up Douglas Luiz to dispatch a crisp and low right-footed shot. Zaniolo, withdrawn from the Italy squad to help the investigation into illegal betting activity, contributed tidily. He has let it be known he will contest any claims that he has bet on football. West Ham appeared reluctant to come out and play until they went 2-0 down. From Lucas Paquetá’s poor pass backwards, five minutes into the second half, Edson Álvarez fouled Ezri Konsa. Douglas Luiz chipped the penalty down the middle. Emery praised Douglas Luiz before urging him to improve. “It’s credit to him, firstly. I am very happy with him. But I think he can do better. There were some moments after he scored the two goals where we were trying to control the game and I wasn’t happy because he was too relaxed. “We have to see where we can improve in everybody. I was very demanding of the players to try and score another goal. After the third goal we controlled the game.” West Ham did respond, Jarrod Bowen scoring with a shot that deflected heavily off Pau Torres, equalling the divisional record with goals in his first five away games of a season. Just as West Ham were starting to turn the screw, however, Villa regained their two-goal buffer. John McGinn capitalised on Mo Kudus’s miscontrol, sending Watkins away down the inside-left channel with a pass that swerved enticingly into the striker’s path. One stepover later, Kurt Zouma sent for a hotdog, Watkins crashed a left-footed shot into the near top corner for his ninth goal for club and country this season. “We’ve done a lot of good things this season,” David Moyes said of his West Ham side, “but today we didn’t do a lot right.” Leon Bailey made it 4-1 in the 89th minute as he stepped inside Nayef Aguerd and shovelled his left-footed shot into the top corner. It is the first time since 1920 that Villa have scored at least three goals in each of their opening four home league games."
Forest,2,Luton,2,Elijah Adebayo strikes to complete late Luton comeback and deny Forest,https://www.theguardian.com/football/2023/oct/21/nottingham-forest-luton-premier-league-match-report,2023-10-21,"Rob Edwards hailed “magic” super-sub Elijah Adebayo after the striker’s stoppage-time equaliser saw Luton salvage an unlikely point at Nottingham Forest. Forest led 2-0 in the 83rd minute through Chris Wood’s second-half double, but Chiedozie Ogbene gave the Hatters a lifeline and Adebayo’s superb effort snatched them a point. The 25-year-old took Tom Lockyer’s long ball into the box on his chest and buried a low shot in the second minute of added time as Luton, promoted via the playoffs in May, registered just their fifth point from nine matches. The Luton manager, Edwards, said: “It was a great goal. He’s got those moments. He came on against Burnley and got his goal and he’s done it again today. “He’s got these little moments of magic in him. The assist he got at Sheffield United, the assist at Wembley.. “He was frustrated not to start the game, as I would expect, but that’s what you’ve got to do when you come on. That’s what I want. He gives me a difficult decision to make next week.” Forest forced the early pressure as Wood’s volley was held by Luton goalkeeper Thomas Kaminski and Ibrahim Sangaré headed narrowly over. Luton responded through Ogbene’s low cross, which narrowly evaded teammates Carlton Morris and Brown. Morris fired a low shot wide as Luton made their intentions clear by committing men forward on the counter before another first-time effort from Wood deflected off Teden Mengi for a corner. Tahith Chong’s shot from outside the box was comfortably saved by Forest goalkeeper Matt Turner and Wood failed to get his header on target from Serge Aurier’s cross. Forest went close again on the stroke of half-time when Sangaré somehow missed the target from Morgan Gibbs-White’s low ball across the six-yard box. But the home side broke the deadlock three minutes into the second period. Anthony Elanga threaded a neat through ball into Wood’s path and the striker provided an emphatic left-footed finish. Wood should have made it 2-0 moments later when he headed Aurier’s excellent cross inches over. Wood appeared to have sealed the points for Steve Cooper’s side with a fine header from Elanga’s pinpoint, inswinging cross with 14 minutes remaining. But the Hatters refused to lie down. Their appeals for a penalty as Morris went down inside the box were dashed by VAR before Ogbene lashed home a volley from eight yards, which stood after another VAR check. Still the visitors were not finished. Tom Lockyer launched a long ball into Forest’s penalty area and Adebayo took it superbly on his chest before firing home to haul his side level. Edwards added: “I’m really proud of the players. The spirit, the fight and determination. We finish the game strongly. We will never give up, we will always keep fighting.” Nottingham Forest manager, Steve Cooper, could not hide his frustration after his side’s winless run was extended to five matches. “We dominated the game and we’re disappointed we weren’t leading by one or two goals at half-time. “We obviously got the early goal in the second half and then made it 2-0 and it all changes on a set-piece, which we defended terribly really. Of all Luton’s threats off set-plays, it was the worst delivery of the day and ends up in the back of our net and that’s where the momentum changes. “It’s a real pity because the way we played for however long it was before their first goal went in, it was a comfortable game for us.”"
Sheffield,1,United,2,Dalot’s stunner gives Manchester United hard-fought win at Sheffield United,https://www.theguardian.com/football/2023/oct/21/sheffield-united-manchester-united-premier-league-match-report,2023-10-21,"Diogo Dalot scored the kind of goal that Sir Bobby Charlton plundered by the barrel-load in his Manchester United days, and it settled an absorbing muck-and-nettles contest against struggling Sheffield United. It’s no secret that the Reds have slipped some distance from the days of Sir Bobby – many fans would now accept far less than the heights he scaled in his heyday – but the death of Manchester United’s greatest ever player cast a long shadow over this fixture, after the news broke four hours before kick-off. Charlton was part of the fabric of football, not just his old club. All sides of Bramall Lane stood and partook in the minute’s applause before kick-off – a mark of the esteem in which he was held over the Pennines, across the country and beyond. Erik ten Hag suggested some of his squad were inspired to mark the occasion with a win, Dalot among them. Harry Maguire may not belong in the same class as Charlton – few of Ten Hag’s crop do – but United were given a timely reminder of the importance of leadership as they came under siege under the Saturday‑night lights. The kind of leadership Sir Matt Busby harnessed when Charlton made his breakthrough alongside Duncan Edwards et al. Clearly at home in the South Yorkshire rough and tumble, Maguire embodied the United spirit on this unique occasion. He was applauded by the home supporters of his boyhood Blades before kick-off and then produced a man-of-the-match display to silence his many critics. He got an ovation from the visiting fans at the end as well. Perhaps it’s no coincidence that United have a 94% win rate with Maguire in the starting lineup over the past 12 months. OK, he could have joined West Ham in the summer, but with neither Lisandro Martínez or Raphaël Varane fit to start, Ten Hag was glad to have a leader in the man he took the captaincy away from. “Harry is playing like we want him to,” said Ten Hag. “He’s being proactive, he’s dominating his opponent, stepping in, reading the game but he’s also very proactive in possession, vertical passing, good switches. I’m very happy for him.” Bruno Fernandes led from the front too, setting aside his recent patchy form to set up Scott McTominay’s 28th-minute opener, and maintaining his menace in the second half to dovetail with the substitutes Christian Eriksen and Alejandro Garnacho; together they prompted a marked improvement from the visitors to run out deserved winners. Fernandes and Sofyan Amrabat struck the woodwork as United sought to re-establish their lead after the Blades equalised via Oli McBurnie’s penalty, which was slotted past André Onana after McTominay’s handball. But where his two teammates had narrowly erred Dalot did not, screaming home a 20-yard drive that ignited red flares in the away contingent. Garnacho had been the necessary spark on the pitch, combining with Victor Lindelöf who then squared for Dalot to seal it. It was no less than the men from Manchester had warranted, a strike Sir Bobby would have been proud of – albeit the display was far from vintage, Sir Bobby-era United. As Ten Hag said: “First half it wasn’t the standard of Sir Bobby Charlton. Second half was better.” McBurnie and Sheffield United reflected on an opportunity missed. “That is probably the story of our season,” he said. “We have been in a lot of games. It is tough to take. It’s unfortunate because I think the boys have defended really well for a lot of the game and the right-back sticks one in the bin from 25 yards.” His manager, Paul Heckingbottom, was emboldened by his side’s performance but they are still without a win. “Today we had more of an all-round threat, but I still thought we could have been better,” he said. A second successive hard-fought 2-1 win over one of the Premier League’s lesser lights will do little to sway Ten Hag’s critics. Here, he was indebted to Dalot, to Garnacho and, whisper it, to the Sheffield steel of Maguire, too. “I felt with the win we gave a little bit of joy on a sad day,” was Dalot’s conclusion."
Chelsea,2,Arsenal,2,Declan Rice and Leandro Trossard strike late to earn point for Arsenal at Chelsea,https://www.theguardian.com/football/2023/oct/21/chelsea-arsenal-premier-league-match-report,2023-10-21,"Arsenal looked finished. Trailing by two goals, there were just 13 minutes to go and the story looked set to be about a statement win for Mauricio Pochettino and Chelsea; Arsenal goalkeeping woe, too. David Raya was at fault for the Chelsea second, allowing a swirling ball in from Mykhailo Mudryk to sail over his head and drop into the far corner. Was it a visionary lob from the left or an intended cross? Only Mudryk knows. What was more obvious was that Raya’s positioning was suspect. He seemed to lose his bearings under the ball and was a good way off his line. Moments later, he would pass straight to Cole Palmer, who had opened the scoring from the penalty spot and was only just denied now by Raya for 3-0. It said everything about the frustration of the Arsenal support that they would chant the name of their deposed No 1 Aaron Ramsdale, who was absent from the bench after his wife gave birth to a baby boy. Yet Raya was not the only goalkeeper to suffer. Robert Sánchez saw Raya’s travails and re-raised. The Chelsea No 1 went for a low pass out and got it horribly wrong, missing blue and finding red in the shape of Declan Rice, who returned the ball with interest from 25 yards into the mainly empty net. Chelsea’s hold was broken, the comeback was on and Arsenal would complete it almost immediately after Pochettino had introduced his captain, Reece James, for his first football since the opening weekend of the season as part of a double substitution. James slotted in on the right of a midfield three, in front of the right-back, Malo Gusto, and it was the latter who lost another substitute, Leandro Trossard, after a Bukayo Saka cross. With Sánchez rooted to his line, Trossard steered home with the outside of his right boot. Chelsea had been the better side until Rice’s goal, their performance teeming with intensity. And yet Arsenal might have burgled all three points when another substitute, Eddie Nketiah, stretched in front of Thiago Silva to hook a shot just beyond the far post. Mikel Arteta looked as though he was ready to implode towards the end of seven minutes of stoppage time, balling up his fist and shaking it, his expression one of thunder after a decision had gone against his team. But the Arsenal manager had to be happy with the point, especially as the Chelsea substitute Nicolas Jackson had almost beaten Raya moments earlier. Arsenal were off colour in the opening 25 minutes, their passing loose, second best in the duels, and they were reeling when the penalty was awarded. Mudryk had headed a Gusto cross at goal and, in the moment, it really did look as if it had hit William Saliba’s hand. The referee, Chris Kavanagh, allowed the play to continue but the VAR wheels were turning and, moments after Marc Cucurella had chopped into Saka, Kavanagh was asked to take a look at the pitchside screen. Arsenal argued that Saliba was too close to get his hand out of the way, also that it is impossible to jump without using said limb for leverage. It was to no avail. Palmer’s kick was nerveless. It was feisty, Palmer booked early on for a scrape down the back of Gabriel Jesus’s heel, and it was easy to think that Cucurella had targeted Saka. Arteta was unhappy at Cucurella’s first challenge on Saka in the sixth minute; there were 17 on the clock when the full-back took another swipe at his opponent. There was irony to Cucurella’s yellow card on 71 minutes; the foul on Saka was the softest of the lot. Pochettino had started with Palmer at centre-forward, Conor Gallagher behind him. Gallagher had gone close at the very start, seeing a shot blocked by Ben White while he also released Palmer on the half hour, who dragged narrowly wide. What did Arsenal create before the interval? Very little, despite gradually establishing themselves higher up the pitch. A cross-cum-shot by Rice was not enough of one or the other. Jesus crossed to nobody after Sánchez had hared out of his area, on the left-hand side. Jesus also saw a shot blocked by Silva. Mudryk’s streaky goal was a hammer blow to Arsenal’s hopes and it had to be him, not only because of the narrative strand that clung to him – the one about how Arsenal tried to sign him before he went to Chelsea in January. The winger is finding his feet at Stamford Bridge, his confidence stabilising after a tricky start. Arsenal had their chances in the second half. Gabriel Martinelli saw a shot diverted wide by the outstanding Silva while the substitute Takehiro Tomiyasu headed over after Sánchez had bolted from his line on a corner. Gabriel Magalhães had another header blocked by Levi Colwill. But Pochettino was probably right to say it was closer to 3-0 than 2-1. Jackson ran through only for Raya to deny him and Palmer got a curled finish wrong. Chelsea were comfortable. Then they were not."
Brentford,3,Burnley,0,Bryan Mbeumo sparks Brentford victory to teach Burnley harsh lessons,https://www.theguardian.com/football/2023/oct/21/brentford-burnley-premier-league-match-report,2023-10-21,"Thomas Frank celebrated five years at Brentford this past week, time in which he has established himself and his club in the Premier League. This season threatened to be his most difficult and a first league win since August, the first at home and over potential relegation rivals, proved most welcome. Their victory, including two spectacular goals, might have been more comfortable without another case of VAR confusion. Vincent Kompany and his team have much to learn from the west London club. “Overall, not good enough,” he admitted. Nine matches in, having beaten only Luton, there are serious grounds for concern over last season’s Championship winners. They failed to cope with what Frank described as the “high pressure, high intensity and big energy” of his team. Having faced four of last season’s top seven at Turf Moor, concerns about home form might be set aside but this commenced a crucial pair of away matches. Still winless Bournemouth follow next week but signs at the Gtech were unpromising from the start. Neal Maupay has gone 31 matches without a Premier League goal but should not have been allowed space to shoot wide from a Mathias Jensen free-kick in the opening seconds. Burnley appeared to be relying on Maupay’s lucklessness, and fell on the right side of the type of VAR ruling that damages the protocol’s reputation. Maupay slotted the ball in the net after Nathan Collins hooked the ball back for him to volley in. Kristoffer Ajer had been offside but did not look to be interfering with play, as was the official explanation that belatedly arrived. Frank was incandescent in arguing with the fourth official, Darren England, infamous for his role in Luis Díaz’s disallowed Liverpool goal at Tottenham. This time, the VAR decision maker was Stuart Attwell and Frank, while happy with the win, felt it was “borderline” at best. “Kristoffer is not affecting the situation,” he said. With Kompany raging, England was receiving pelters from both dugouts, though Brentford’s broke into cheer following their opener. Sander Berge was caught in midfield by Maupay and a switch of play with Bryan Mbeumo gave his attacking partner, Yoane Wissa, a tap-in. From the half-hour, Burnley were fortunate not to be several goals down; their out-balls to the lonesome Lyle Foster reeked of desperation. Frank, who revealed he would celebrate his anniversary and three points with “a good red wine and a little bit of tapas” pronounced his team’s first-half display as “maybe our best performance this season”. “Going in losing 1-0 was flattering for us,” Kompany admitted. “You can’t put in 45 minutes like that.” Not that Brentford fans lacked for anxiety. As chances came, a team that had surrendered 11 points from winning positions were in danger of squandering more once Burnley began the second half strongly. Frank was booked for more criticism of England but his mood improved after Maupay – his overall play excellent and who left the field to warm applause and an “eight or nine” rating” from his manager – set up Mbeumo for a lashing finish. Once the Burnley substitute Luca Koleosho missed from yards out after Foster’s break laid him a chance on a plate, and Connor Roberts was sent off for a second bookable offence, Burnley’s fate was sealed. Saman Ghoddos’s 25-yard wallop past Trafford pressed home how far Kompany and co must travel to emulate Frank and Brentford. “Can you still be resilient?” Kompany asked of his players. “Can you face the truth? It’s for us to pick ourselves up.”"
City,2,Brighton,1,Erling Haaland on target as 10-man Manchester City edge past Brighton,https://www.theguardian.com/football/2023/oct/21/manchester-city-brighton-premier-league-match-report,2023-10-21,"A lot has happened since Manchester City’s FA Cup third round victory over Chelsea at the Etihad Stadium in January. That was the start of a record-breaking run that helped City win a historic treble. Such triumphs can make it a struggle to find the motivation to keep improving but a 21st straight home victory in all competitions over Brighton, to surpass Manchester United’s run of 20 more than a decade ago, shows how high the standards are. As well as finding new methods of inspiring his team, a summer refresh of the squad has brought a new dynamic to City. One of those arrivals, Jérémy Doku was key to their attacking prowess here. Whenever the winger received the ball, there was a brief hush as fans awaited where his dribbles would finish, the answer usually being past James Milner, as the veteran was reminded of his 37 years and the fact he is not a full-back by trade. It caused Roberto De Zerbi to do the kindest thing by removing him at half-time, with Brighton behind thanks to goals from Julián Álvarez and Erling Haaland. “He is an exceptional winger, so smart and intuitive to get the ball,” Pep Guardiola said of Doku. “After the quality to beat one or two guys to the byline for the first goal. “Really pleased for his impact since he came into us and for many years to come in this house.” De Zerbi is one of the names tipped to replace Guardiola when he departs. His tactical acumen and eagerness to attack are key reasons behind his success. In the early stages Brighton went man-to-man with City’s back four, as they looked to target a perceived weakness but it took the introduction of Ansu Fati to wrestle control away from City. Few teams that go toe-to-toe with City come out of it well and Brighton were behind in the seventh minute. Doku’s pace was too much for Pascal Gross on the left wing, allowing him to reach the byline and pick out Álvarez who took aim with his left foot but miscued it, not that it mattered as the ball flew in off his right in-step for his 17th home goal in as many starts. Brighton worked hard, making them frustrated when Carlos Baleba gifted the ball to Haaland 20 yards from goal. He drove for the edge of the box and viciously sent his shot into the bottom corner with the sort of power the recently departed City legend Franny Lee would have been proud of. The quality available at Brighton is undeniable and they became more dangerous as the game went on. While Doku made Milner question his life choices, Kaoru Mitoma caused constant problems for Kyle Walker, one of the world’s best right-backs, in the second half to put City on the back foot. It was a very open game as City looked to end the match as a contest and Brighton to find hope. One second Lewis Dunk was clearing an Álvarez shot off the line with Jason Steele out of his goal and within moments, Brighton countered, with Mitoma causing the problems again down the left and Fati capitalising on a poor Manuel Akanji clearance to finish but they could not find an equaliser. “If we play with more courage and personality, we can play like we did in the second half,” De Zerbi said. “We were shy in the first half. We might lose 6-1 but that is not a problem because I want to play with personality.” In addition to completing a 14th away league match against City without a win, Brighton suffered the blow of Solly March suffering a serious injury, leaving him in distress before being taken off on a stretcher. For City, who finished the match with 10 men after Akanji received a second booking late on, this win will add a new paragraph to the record books but, more importantly, it got them back to winning ways after two straight defeats."
