Home_Team,Home_Score,Away_Team,Away_Score,Headline,URL,Date,Article
Fulham,1,Luton,0,Fulham’s Vinícius extends Luton’s pursuit of first Premier League point,https://www.theguardian.com/football/2023/sep/16/fulham-luton-premier-league-match-report,2023-09-16,"They came more in hope than expectation. But while Luton’s wait for a first Premier League point goes on after substitute Carlos Vinícius secured Fulham’s first home win of the season, the away supporters still have plenty of reason to feel optimistic despite now sitting bottom. Having conceded nine goals in their first three matches at the top table, this was a markedly improved performance from Luton as it took until midway through the second half for Fulham to find the breakthrough within minutes of Vinícius’s introduction off the bench. Up to that point, it had been the visitors who had created the better chances after weathering an early storm, with Jacob Brown and Amari’i Bell spurning excellent opportunities. “I’m very proud of the lads – we were in the game until the very last minute,” said Rob Edwards. “We had three great chances and I could be in here talking about us taking something from the game. We’re disappointed but I’ve seen progression again from a couple of weeks ago.” Edwards had been stung by criticism from Garth Crooks after the BBC pundit said this week he “can’t take them seriously” and tipped Luton to be relegated by Christmas. The former Tottenham striker has since been invited to take part in a training session, although Edwards acknowledged he has more important things to worry about. Fulham, who paid tribute to their former chairman Mohamed Al Fayed, who died last month at the age of 94, with a scarf-whirling welcome before kick off, were relieved to hang on in the end thanks largely to a dominant display from João Palhinha on his first appearance since a last-ditch transfer to Bayern Munich fell through. Palhinha extended his contract until 2028 on Friday to provide some relief at last for Marco Silva after a difficult summer for Fulham as they lost top scorer Aleksandr Mitrovic to Saudi Arabia. “Since the first minute that he joined the club, João has been excellent for us and he showed it again today,” said Silva. “I’ve never had doubts about his commitment.” Having finally avoided immediate relegation back down to the Championship at the third attempt last season as they exceeded all expectations by finishing 10th, on this evidence, it may be more of a struggle without the Serbia striker despite the quality remaining at Silva’s disposal. Mitrovic’s replacement, Raúl Jiménez, offered little in attack apart from an attempted overhead kick that led to Fulham’s first real opportunity after 20 minutes as Kenny Tete headed over a corner from close range. Luton’s defensive doggedness and team spirit has driven their rapid climb up the leagues and they seemed to grow in confidence as the first half continued. A last-gasp challenge from Palhinha stopped a counterattack in its tracks before a brilliant cross from Issa Kaboré was headed against the post by Brown. The Luton goalkeeper, Thomas Kaminski, managed to get himself booked for timewasting in the 36th minute as Fulham ended the half having racked up almost 80% in possession but little to show for it in terms of cutting edge. Only Bell will know how he failed to provide the breakthrough within seconds of the restart after Brown picked out the left wing-back unmarked on the back post, with Bernd Leno well positioned to make the save from point-blank range. Fulham responded by picking up where they had left off in the first half in terms of dominating the ball and Palhinha’s header drifted just over the crossbar as they mounted the pressure. Luton stuck to their gameplan as they camped out midway in their own half and dared their opponents to try to break them down on a sweltering afternoon by the Thames. Silva opted to play his hand early by introducing debutant Alex Iwobi and Vinícius off the bench in the 62nd minute and it paid off almost immediately. Willian found some space down the left flank and his teasing ball caught Kaminski in two minds as he could only palm the ball straight into the path of Vinícius, who made no mistake with an instinctive finish. Willian went close to extending their lead as Fulham smelled blood but Luton refused to give up without a fight as Kaboré’s shot was deflected wide to end the day with nothing to show for their concerted effort."
West Ham,1,City,3,Silva and Haaland seal Manchester City’s comeback win at West Ham,https://www.theguardian.com/football/2023/sep/16/west-ham-manchester-city-premier-league-match-report,2023-09-16,"For 45 minutes on a clammy day in east London, a compact and enterprising West Ham seemed to be giving Manchester City their toughest test of the Premier League season so far, a goal up and coiled behind a quick-breaking attack. By the final knockings of the second half the scene was more familiar. The City fans were pogoing about happily in the away end. Erling Haaland had finally scored a goal, after almost scoring a goal more times than seemed humanly possible in a single game of football. And City were romping towards their fifth straight league win of the season, 3-1 up and on the verge of returning to the top of the table. In between Pep Guardiola’s team were indebted to a fine, incisive performance from Jérémy Doku on the left, providing the ball-carrying ability lost by the departure of Riyad Mahrez, and an excellent all-round display from Julián Álvarez. West Ham had played well, with Edson Álvarez and Lucas Paquetá holding their own at times in midfield. But somehow there always seemed to be other gears, other angles for the champions. At the end David Moyes put his team’s defeat down to “small margins”. Frankly, City just look at least a couple of levels up on every other team in the league. The air inside the London Stadium was heavy with end-of-summer heat all afternoon. Before kick-off Paolo Di Canio had come bowling out on to the field waving his arms before unexpectedly breaking into I’m Forever Blowing Bubbles, crooner style. The response was perhaps less feral than he might have hoped, verging more towards mild surprise. And in the opening moments City began like a team intent not just on victory but on wiping every memory of West Ham off the map. With six minutes gone Alphonse Areola made three close-range saves in the space of 10 seconds, with two other shots at goal also blocked as City took it in turns to machine gun the West Ham goal. With 14 minutes gone Doku combined well with Josko Gvardiol. His cross found Haaland completely unmarked (how?) at the back post. He smashed the ball not just wide, but miles wide with his left foot. With Bernardo Silva the other half of the double-pivot in midfield, City always had a free agent in possession. Behind this having four centre-backs in defence didn’t work as well as it has. Gvardiol looked uncomfortable at times trying to conduct the possession in attack. And it was down his side that West Ham broke away to score the opening goal. It was an excellent move begun by Jarrod Bowen, cutting out Gvardiol with a lovely reverse pass to Vladimir Coufal. He galloped unimpeded down the right, waited a beat, then lifted the perfect cross for James Ward-Prowse to dive full-length and nod the ball into the corner of the net. Haaland might have made it 1-1 on 41 minutes after more excellent work from Doku, pirouetting into space on the left and whipping a low cross that the striker met with a weak touch at the far post, the ball eventually kicked away by Edson Álvarez. It took Doku 41 seconds of the second half to equalise. It was all a little too easy. Haaland dropped deep and the ball was fed wide from his lay-back out to Doku, who finally had Coufal isolated, with the right angle to cut in towards goal. He made it look laughably easy, waggling his hips in full flight to throw Coufal one way, then in his next stride curling the ball into the far corner, a wonderful finish for his first City goal. “We played him in pre-season and he caused us a problem then, he’s very direct,” Moyes said. “He was a handful all game.” City were once again all over West Ham like a heavy weather front. Rodri smashed a shot from a free-kick on to the post. Haaland drew a clawing save from Areola with a flying, running scissor volley. Faced with this pressure West Ham were happy to live without the ball and take their moments on the break. From a rare corner Ederson reminded the world that he is also very good at the stuff that involves his hands, diving to make a fine save from Kurt Zouma’s header. The departure of Edson Álvarez, who had already been booked and had arrived home at 4am after a Wednesday international for Mexico in Atlanta, left the midfield a little more open. With 70 minutes gone City had already taken 25 shots to West Ham’s five. Five minutes later they took the lead. It was made by Julián Álvarez, who took the ball from Silva then hooked a pass over the head of two defenders. Silva, running on with mischievous intent, got a toe to it as Areola came rushing out, the ball bouncing down and inside the far post. It was escorted there by Haaland, who chose not to apply the final touch and “steal” the goal, what English football historians call an Anti-Nugent. Before the end Haaland had his moment, left in too much space and free to hammer a low shot into the corner. It was his ninth effort at goal on an afternoon that ended with the familiar sight of City’s players applauding the away end, and even Guardiola himself, just a little bit stiff after his back op, going across for his own welcome-back wave."
United,1,Brighton,3,Brighton pile misery on Manchester United as Welbeck sparks away win,https://www.theguardian.com/football/2023/sep/16/manchester-united-brighton-premier-league-match-report,2023-09-16,"“Can we play you every week,” sang the delirious Brighton fans, whose team moved Manchester United to near crisis territory with this breeze of a victory. Roberto De Zerbi’s XI cost a cool £17m (he made six changes from the 3-1 win against Newcastle), Erik ten Hag’s an eye-watering £347m. Yet this was United’s third defeat from five outings – greeted with jeers by the home support – and a second on the bounce. They have six points from a possible 15 and if they lose at Burnley next Saturday, United are engulfed in a plight not in the early season script. Brighton, rightly, ended the game cock-a-hoop. Danny Welbeck, Pascal Gross and João Pedro scored for the visitors who were threatened only sporadically apart from the opening 15 minutes. At 2-0 down on the hour, Ten Hag acted, introducing Hannibal Mejbri and Anthony Martial for Casemiro and Rasmus Højlund. The latter move was greeted with boos for the manager – a sign of the times – whose desperation was marked by Mejbri having not featured for two seasons. On 71 minutes it got worse: one of De Zerbi’s changes was João Pedro and, as with Brighton’s previous goals, the forward was left unmarked and able to blaze past André Onana, who should have saved. This prompted some fans to depart but Mejbri, perhaps disgusted at his colleagues’ capitulation, strode forward and powered a piledriver past Jason Steele. Yet this was United’s brightest moment on an afternoon that started bathed in optimism. The hope had been that two torrid weeks would be ended by the sight of Højlund lining up for his home and full debut. Like all fans, United’s support enjoy a particular frisson at the sight of a new centre-forward. Especially one who is 20 years old, fast, strong, tall and is the symbol of a supposed new era in which on-field fortunes will make recent off-field affairs fade. Not this afternoon, though Højlund displayed a buccaneering zest shown by one raid that saw him marginally miss bulging the back of Steele’s net from Marcus Rashford’s cross. Cue the Dane pounding a palm into the turf and Brighton were warned. Rashford, operating as the second striker in a novel 4-3-1-2 formation, took inspiration. At this stage, he was a fleet-footed threat that bedevilled a Brighton back four led by the towering Lewis Dunk, who had to cope with Højlund stampeding at him each time he tried to build an attack. A win was required to ease the swirl around the club so Welbeck’s opener was a first blow. The former home favourite steered the ball out right to Simon Adingra and moved into an area where the return pass went past the hapless Victor Lindelöf, who was distracted by Adam Lallana. Welbeck rolled the ball into the net, then celebrated before the Stretford End. Lindelöf shook his head and United had to collectively do the same to break the grip their visitors placed on them. Brighton flowed across the pitch, moving the ball through their opponents as if executing a training exercise. United held on and thrust back. A Casemiro diagonal pass reached Rashford who sprinted at the back-pedalling rearguard and let fly: the ball ricocheted off Kaoru Mitoma and on to the frame of Steele’s goal. Close to the break and the VAR was the visitors’ friend. Højlund’s neat swivel-and-strike was correctly chalked off due to Rashford’s cross arriving after the ball went out on the right byline. Close, sure, but Ten Hag’s talk at the interval had to address how United had faded after a promising start. Rashford’s darting run, a replica of the one that led to Højlund’s ruled-out effort, again ended with no end product as United settled in for a defining half. It became torturous due to another too-simple Brighton goal. Mitoma wandered along the left and found Tariq Lamptey who recycled the ball to Gross: a shimmy made a mug of Lisandro Martínez and Onana was beaten to his right. United were missing a swathe of players headed by Jadon Sancho (for disciplinary reasons) and Antony (a leave of absence), plus those with injuries, including Raphaël Varane and Luke Shaw. Yet Brighton did what they did while deploying rising star Evan Ferguson as a replacement only. The Sancho affair has been the main issue. Ten Hag created this with his openness regarding the forward’s absence from the previous loss at Arsenal. Now has to come a change in what he oversees on the field – and quickly."
Wolves,1,Liverpool,3,Andy Robertson’s late strike powers Liverpool’s fightback win at Wolves,https://www.theguardian.com/football/2023/sep/16/wolves-liverpool-premier-league-match-report,2023-09-16,"A couple of minutes after the final whistle Jürgen Klopp stuck his tongue out, licked his lips and saluted the Liverpool supporters spread across the lower bank of the Steve Bull Stand. Seconds before, Klopp hugged Harvey Elliott and hoisted the substitute off the ground. Then it was Luis Díaz’s turn. The suspended Virgil van Dijk, hovering pitchside, high-fived his teammates off the field. Ten minutes or so earlier Elliott jumped two sets of advertising hoardings to celebrate with the away fans after creating Liverpool’s third goal, another comeback victory in the bag; nine of Liverpool’s 13 points this season have come from a losing position. They are now unbeaten in 16 league matches, dating back to April. It is fair to say there was a different mood in the away dressing room at half-time. “I thought a couple of times in the first half: WTF,” Klopp said, acknowledging this really was a game of two halves. Andy Robertson, who captained Liverpool in the absence of Van Dijk and the injured Trent Alexander-Arnold, admitted Klopp was not best pleased at the break. Cody Gakpo prodded in a Mohamed Salah pass 10 minutes into the second half and it was Robertson who took matters into his own hands with five minutes of normal time to spare, earning Liverpool the lead after picking up another perfect but simple pass from Salah. “He probably only gets credit when he gets goals now, which is slightly unfair,” Robertson said. The acting captain collected a shanked kick downfield by the Wolves goalkeeper José Sá close to the centre circle, burst forward and then punched a pass into the channel for Salah. Robertson carried on his run and arrived at the tip of the six-yard box to latch on to Salah’s pass and make an uncomfortable afternoon suddenly rather more bearable. Once Wolves crumbled, Liverpool went for the jugular and Elliott’s strike from the edge of the box was deflected in by Hugo Bueno. “It was a result I didn’t expect after 20 minutes and maybe even not at half-time,” Klopp said. The buildup to this entertaining early kick-off predominantly centred on Klopp’s grievances at the tight turnaround for his South American contingent – prompting him to use Díaz and Darwin Núñez as substitutes here – but by the end it was his opposite number, Gary O’Neil, who was clocking up the mileage, pacing the Wolves technical area wondering how Wolves lost their grip on the game. Wolves deservedly led through Hwang Hee-chan after brilliant work by the electric Pedro Neto but Liverpool levelled when Gakpo struck with his final touch before being subbed. Núñez and Díaz applauded from the sidelines seconds before entering. Liverpool were woeful for almost the entire first 47 minutes. Alexis Mac Allister was arguably the most off-colour of the lot, leading Klopp to joke that the Argentina midfielder should have stayed a little longer in the oxygen mask he used to cope with the high altitude on international duty in Bolivia in midweek. Mac Allister was booked for a sly tug at the shirt of Matheus Cunha inside four minutes was replaced by Díaz, who himself flew back from Chile playing for Colombia, at the interval. The 20-year-old Jarell Quansah, who spent the second half of last season on loan at Bristol Rovers in League One, deputised for Van Dijk and was the best of a bad bunch on his first start for the club he joined aged five. “In such a disorganised team like we were in the first half, being the one who looks kind of all right is a statement,” Klopp said with a smile. At least this time Klopp could see the funny side. The introduction of Díaz and then Núñez – and shifting towards a 4-2-4 when attacking – allowed Liverpool to ask questions of Wolves who, aside from a desperate save from Dominik Szoboszlai on the verge of half-time, had been untroubled. Wolves’s all-action midfield trio of the debutant Jean-Ricner Bellegarde, Mario Lemina and the ubiquitous João Gomes was broken up with 13 minutes to play as fatigue set in. Wolves’s energy dropped but it turned out Liverpool were only just getting started. “You know you’re not going to be the best side against Liverpool for the whole game,” said O’Neil. “If we were getting that much joy against Liverpool for 90 minutes, we’d probably be competing for the title.”"
Arsenal,3,United,1,Declan Rice late strike earns Arsenal dramatic Manchester United victory,https://www.theguardian.com/football/2023/sep/03/arsenal-manchester-united-premier-league-match-report,2023-09-03,"Despair to joy in the closing stages, this was some turnaround, some way for Arsenal to ignite their season. And some way for Manchester United’s away-day misery to continue. As the Emirates Stadium bellowed the name of their team, United’s pain knew no bounds. Alejandro Garnacho thought that he had won it for the visitors, thought he had landed the most perfect of sucker punches. On as a substitute, the winger accelerated on to a Bruno Fernandes pass in the 89th minute to finish past Aaron Ramsdale and into the Arsenal net. Garnacho had struck late on at Fulham last season to secure Erik ten Hag’s only win in London. It continues to stand as such because of a wild sequence of events that had the Emirates Stadium rocking. First, the VAR spotted that Garnacho had been fractionally offside when he began his run. On the replay it looked as if Gabriel Magalhães, the last Arsenal defender, had sucked in his stomach as he stepped up in the middle. Then Arsenal stole it. Did they deserve to win? It was hard to say after a topsy-turvy game in which they were not convincing, their combinations lacking zip and precision. Not that United were any better. But the bulk of those present did not stop to ask the question. They simply let the emotions run over them after Declan Rice, unmarked beyond the far post on a corner in the sixth minute of stoppage-time, took a touch and his shot flicked off the United substitute Jonny Evans to beat André Onana. It was some way for Rice to score his first Arsenal goal after his £105m summer arrival from West Ham. Ten Hag wanted a foul against Evans by Gabriel. It was not there. In the 81st minute Arsenal thought they had made the decisive move only for Onana to save with his feet from Bukayo Saka. When they showed the replay on the big screen, there was a collective gasp from the home crowd. Saka was at close range when a low cross broke for him and he had to score. But now Arsenal were ahead and the stadium descended into ear-splitting pandemonium when another substitute, Gabriel Jesus, streaked clear at the very end to cut inside Diogo Dalot and roll past Onana. United have still to record a Premier League win at a major rival under Ten Hag and Arsenal have now beaten them three times in a row here. They last achieved that feat in the league in 1991. They have won five and drawn one of the previous six meetings with United at this venue. There were plenty of difficult-to-answer questions, the first concerning how United were able to take the lead on 27 minutes. Until then they had struggled to get beyond the midfield, living on the end of their nerves when building from the back, wayward when going long. Arsenal settled the quicker, determined to play on the front foot and they had the first big chance. Kai Havertz won possession and got his team moving only to miskick badly when the goal beckoned, United having made a mess of clearing a Gabriel Martinelli cross. Inevitably, it was Marcus Rashford who did the damage for United. Christian Eriksen had sparked the break, stepping up to intercept a loose Havertz pass and it was up and over to Rashford. He sliced inside from the left and, with Ben White and William Saliba not close enough, he steered an expert finish inside the far corner. It took Arsenal all of 35 seconds to equalise – a bitter frustration for Ten Hag, United’s undeserved ascendency frittered away. The green and white stripes (yes, United) watched Arsenal ping a few passes, Martinelli playing the key one, a lovely cut back for Martin Ødegaard and he swept home. Every United fan knew their team could conceivably have arrived at the Emirates Stadium with zero points instead of six, results having greatly outstripped performances. They badly needed something more cohesive, an answer to the questions that seem to be everywhere – and that is before we get to the ongoing Glazer drain, the sapping torment of the owners’ tenure. They were better in the second half but it was not enough. Injuries have bitten. Raphaël Varane, Luke Shaw, Tyrell Malacia and Mason Mount are out and there was yet another problem for Ten Hag when Lisandro Martínez was forced off after hurting himself when making a yellow-card tackle on Eddie Nketiah in the 66th minute. Scott McTominay did not travel because of illness. On came Harry Maguire to predictable derision from the Arsenal fans and to partner Victor Lindelöf. Ten Hag would finish with Maguire alongside Evans, the free agent signing – surely not the central defensive pairing he would have envisaged in a Champions League season. Lindelöf had spent a booking on a cynical foul on Ntekiah just before half-time and, after Ramsdale had denied the disappointing Anthony Martial, White blocking the rebound from Rashford, Arsenal thought they had a penalty. Havertz got away from Aaron Wan-Bissaka and in front of Casemiro before he went down. But the VAR saw that he had anticipated the contact rather than actually felt it and overturned the award. Once again, it was not Havertz’s day. Ten Hag introduced the £72m signing Rasmus Højlund and he had a couple of promising moments on his debut, Ten Hag feeling he might have had a penalty from a tussle with Gabriel. Martinelli guided a shot narrowly wide and Rashford would menace at the other end. Cue the late drama."
