Home_Team,Home_Score,Away_Team,Away_Score,Headline,URL,Date,Article
Everton,0,United,3,Garnacho acrobatics spark Manchester United and douse Everton’s fire,https://www.theguardian.com/football/2023/nov/26/everton-manchester-united-premier-league-match-report,2023-11-26,"Everton burned with a sense of injustice over the record 10-point deduction that has revived relegation fears just when it seemed Sean Dyche’s side had left them behind. Manchester United performed with cool heads and cold intent instead, and savoured the biggest win of their improving season as a result. United’s previous seven league wins this season had all been by a single‑goal margin but here, against an Everton team reeling from the heaviest sporting sanction in Premier League history, an ultimately comfortable victory was built on character plus the clinical touch that their opponents lack. A stupendous overhead kick from Alejandro Garnacho set Erik ten Hag’s team on their way to an impressive win in which the 18-year-old Kobbie Mainoo excelled on his full debut. A second-half penalty from Marcus Rashford proved pivotal in taking the game away from Everton. Anthony Martial provided the gloss with his first goal of the season late on. Dyche’s team created a host of good chances – they had 24 attempts on goal compared to United’s nine – and adapted well to the unique circumstances that have enveloped the club. But finishing deserted them yet again at Goodison Park. Everton are five points from safety and cannot allow themselves to become demoralised by a punishment not of their players’ making. “The message to them is, we can cry and worry about it and say it is unjust, and I think the whole of football thinks it is unjust,” the Everton manager said. “Or we get on with it. We can’t guarantee the appeal, only what we can do about it each week on the pitch.” Everton protests against the Premier League were well funded, with more than £40,000 raised for the various banners and 38,000 pink cards that filled Goodison Park, impressively coordinated and executed en masse. There was a wild atmosphere inside the old ground with boos starting as soon as two men stepped on to the pitch carrying Premier League signage before kick-off. But what an angry crowd and a fired‑up team could not legislate for was an early moment of sheer brilliance from Garnacho. His wondrous overhead kick drew the sting from Everton’s ire, temporarily, and provided an emphatic reminder of the individual talent at Ten Hag’s disposal. For all the angst that surrounds United’s season they are now the league’s in-form team since the beginning of October with five wins from six matches and 15 points. Confidence is one thing Garnacho does not lack, as he confirmed after only 136 seconds. Everton were exposed by a cross‑field pass from Victor Lindelöf out to Rashford on the right. It would not be the only occasion. Rashford released Diogo Dalot to the by-line and, though his deep cross was sailing away from the danger zone, Garnacho read its flight to perfection. Taking a step back, and turning away from goal, the teenager launched himself into the air to meet Dalot’s delivery with an unstoppable overhead kick that flew into the top corner of Jordan Pickford’s goal with the Everton goalkeeper well beaten. The contender for goal of the season was reminiscent of Wayne Rooney’s spectacular winner for United against Manchester City in 2011. It was no surprise to hear United fans reprising their old Rooney chant moments later. Garnacho’s goal stunned Everton but gradually their composure on the ball improved to match their intensity. The hosts created enough chances to have led by the interval. Dominic Calvert-Lewin met James Garner’s corner with a towering header that he placed too close to André Onana. The Everton striker forced a better save from the United keeper with a first-time shot and Dwight McNeil was close to converting the rebound only for Mainoo to clear off the line. The 18‑year‑old was hugely impressive on his first Premier League start and demonstrated why Ten Hag had such high hopes for the central midfielder before injury struck in pre‑season. He denied McNeil again with a fine block when the Everton winger found space inside the United area. Abdoulaye Doucouré and Idrissa Gana Gueye, goalscorers in the win at Crystal Palace before the international break, were both guilty of glaring misses as Everton increased the pressure before half-time. Goodison’s anger turned towards the referee, John Brooks, after a series of inconsistent decisions, including booking Doucouré for dissent when asking why Garnacho was not cautioned for kicking the ball away. Everton’s sense of grievance deepened when Brooks awarded United a penalty after a pitch‑side review. The referee initially booked Martial for diving over Ashley Young’s outstretched right foot as he darted into the area. VAR advised Brooks to take a second look and he deemed Martial to have been tripped by the veteran defender. Bruno Fernandes showed a captain’s touch by giving the penalty to Rashford in a bid to boost the striker’s confidence. He duly smashed only his second goal of the season into the top corner. Martial wrapped up victory at the end of a flowing United move instigated by the substitute Facundo Pellistri. Fernandes dissected the home defence for the forward to lift a nonchalant finish over Pickford and claim his ninth goal in 17 appearances against Everton. He is not the only one whom Everton believe has it in for them."
Spurs,1,Villa,2,Ollie Watkins delivers clinical edge in Villa win and third straight loss for Spurs,https://www.theguardian.com/football/2023/nov/26/tottenham-aston-villa-premier-league-match-report,2023-11-26,"Sometimes it is easy to be led by the scoreboard. This was a pulsating battle between two clubs energised by smart managerial appointments and there is a temptation to argue that the turning point came when Aston Villa somehow went in level at half-time, allowing Unai Emery to bend the game to his will with a double substitution that gave a previously rampant Tottenham Hotspur more questions to answer during the second half. It was proactive management from Emery, who was too cute to be fooled by Pau Torres hauling Villa level in the seventh minute of added time. Doing nothing would have been complacent. Tottenham had dominated, Giovani Lo Celso putting them ahead, and they could have been out of sight at the end of the first half. “Any other day we probably win comfortably,” Ange Postecoglou said. “It’s fine margins in football.” Postecoglou and Emery both thought of the missed chances. Given a chance to regroup the Villa manager duly responded, Youri Tielemans and Leon Bailey replacing Moussa Diaby and Matty Cash, and the decisiveness was most evident when the winner arrived in the 61st minute. After all it was Tielemans who played the pass when Ollie Watkins, who was keen to put a disappointing display for England behind him, scored the goal with which Villa took fourth place from Spurs and moved to within two points of the top of the table. Yet, while Watkins’ 12th goal of the season meant Villa set a club record of 22 Premier League wins in a calendar year, Emery refused to get carried away. There was no talk of a title challenge. Instead, there was realism from Emery, who said seven clubs have a better chance than Villa of finishing in the top four. Perhaps that was why Postecoglou stayed positive after his side’s third consecutive defeat. The Australian would have been more concerned if Spurs, who will surely improve once key players return from injury, had played within themselves on a day when they remembered their former midfielder and manager, Terry Venables, after he died at the age of 80. The action was frenetic from the start. Destiny Udogie and Dejan Kulusevski threatened for Spurs, the latter hitting the woodwork, while Villa looked dangerous from crossing positions. Torres, all alone from John McGinn’s free-kick, was aghast to send a free header wide. Spurs respected their attacking heritage. Before kick-off they remembered Venables, who won the FA Cup as a Spurs player in 1967 and as their manager in 1991, while the walk down memory lane continued when the teamsheets arrived: Postecoglou had channelled his inner Ossie Ardiles by selecting a back four of full-backs, named one defensive midfielder and given Bryan Gil and Lo Celso their first starts in the league this season. It was terrific fun. Spurs pushed, Gil testing Emiliano Martínez, and kept trying to breach Villa’s risky high line. Ezri Konsa was struggling at right-back and Villa conceded. Pedro Porro’s corner from the right bounced through a mass of bodies and the ball came to Lo Celso, who was alone on the edge of the area and free to score with a shot that went in off Diego Carlos. Kulusevski almost made it 2-0 and Son Heung-min had a goal disallowed. Spurs were overwhelming Douglas Luiz and Boubacar Kamara in midfield and Emery’s use of Cash in an advanced position was not working. The right‑back’s only notable contribution was being booked for the foul that forced Rodrigo Bentancur to go off 32 minutes into the Spurs midfielder’s first start since February. Yet Villa rallied. Spurs were vulnerable with Eric Dier unable to start and Ben Davies and Emerson Royal filling in for Cristian Romero and Micky van de Ven in central defence. There were no leaders at the back and Villa thought they had levelled moments after Lo Celso’s goal, only for a lengthy VAR check to show that Watkins had strayed offside when he headed Lucas Digne’s cross past Guglielmo Vicario. No matter. Villa’s crosses were causing damage and they soon had a straightforward equaliser. Douglas Luiz delivered a free-kick from the right, Davies lost Torres and the defender headed home. Not that Emery was happy. The mood changed when he brought Bailey on for his running and Tielemans for his passing. Villa were more secure on the right, though Spurs still threatened, Brennan Johnson almost converting Kulusevski’s cross. Yet Spurs were nervous without the ball, especially with Pierre‑Emile Højbjerg a less effective shield than Bentancur. Gaps appeared and Villa advanced. Bailey almost embarrassed Vicario and it was not long before Villa were ahead. Bailey found Watkins and after playing a one-two with Tielemans the striker ran through to squeeze a shot past Vicario. Spurs, missing the creativity of James Maddison, refused to give up. There were chances for Porro, Davies, Johnson and Højbjerg but Martínez was in inspired form. Villa had done enough. While Emery was grateful for the options on his bench, Spurs felt their lack of depth come back to bite them. Postecoglou was able to name only eight substitutes, including two goalkeepers, and he knew it was not going to be his day when Son had another goal disallowed."
Sheffield,1,Bournemouth,3,Fans turn on Sheffield United as Marcus Tavernier double lifts Bournemouth,https://www.theguardian.com/football/2023/nov/25/sheffield-united-bournemouth-premier-league-match-report,2023-11-25,"Marcus Tavernier fired a double as Bournemouth dismantled Sheffield United to maintain their resurgence under Andoni Iraola. Tavernier struck early in both halves, his brace sandwiching Justin Kluivert’s first Premier League goal. Substitute Oli McBurnie headed a stoppage-time consolation for the Blades, who remain in the relegation zone after a 10th defeat in 13 league games. Bournemouth, high on confidence after a 2-0 win over Newcastle in their previous game, cruised to their first league win on the road this season and the margin of victory could easily have been wider. After seeing his side sweep the Blades aside, Iraola was delighted with Tavernier’s contribution. He said: “He was playing really well in the last games but he had some chances he didn’t finish, against Burnley and Newcastle. “But it was a matter of time because he has the quality. It’s good he gets the reward because he is contributing in such different ways to the team. I’m really happy for him.” Tavernier, who missed the first month of the campaign through injury, scored five Premier League goals last season. With Dominic Solanke scoring six times this season and Kluivert – son of former Netherlands striker Patrick – notching his first goal for the club, Iraola saluted his side’s all-round offensive threat. “I think we have talent there, I think we have goals there, behind Dom. We were having the chances. They were not scoring the goals before and I think it is good for them confidence-wise to come here and to score in such an important game.” Bournemouth took the lead in the 12th minute when Antoine Semenyo cut in from the right and his ball into the box found Tavernier, who evaded his marker with a neat first touch before burying a shot under goalkeeper Wes Foderingham. Sheffield United then added to their own problems by gifting Bournemouth a second in first-half stoppage time. Foderingham was dispossessed on the edge of the box by Kluivert, who then steered the ball into an empty net and Paul Heckingbottom acknowledged his side’s performance levels had dropped. “Yeah, that’s been the topic of conversation in there,” the United manager said. “If we give goals away like that we’re not going to win games in this league, we know that. “We started poorly and never really recovered. We can’t hide behind mistakes, though, we need to play better than that and get it out of our heads before the next game.” The home side were booed off at the interval and fans vented their frustration again six minutes after the restart when Bournemouth added a third goal. Adam Smith clipped in an excellent cross from the right when left unopposed and Tavernier ghosted in at the far post to sidefoot home. James McAtee fired wide for the Blades following a goalmouth scramble but Bournemouth threatened to add to their tally. Foderingham kept out further efforts from Semenyo, Kluivert, Ryan Christie and substitute Luis Sinisterra while tempers flared in the 69th minute, with George Baldock, Jack Robinson and Bournemouth substitute Philip Billing all booked after a melee. McBurnie’s late header was scant consolation for United, who face bottom club Burnley at Turf Moor on Saturday, and Heckingbottom added: “We’re going to have moments in this league, we are not stupid enough to know we will be at our best every week. “But we have to try. We have to quickly get this out of our heads for Burnley next week.”"
City,1,Liverpool,1,Trent Alexander-Arnold strikes to earn Liverpool vital point at Manchester City,https://www.theguardian.com/football/2023/nov/25/manchester-city-liverpool-premier-league-match-report,2023-11-25,"Trent Alexander-Arnold did more than help to create a small piece of history and deny Manchester City a bigger one. When the Liverpool right- back hammered a lovely shot from distance past Ederson and into the far corner, he signalled his team’s readiness to go the distance in the Premier League title race. City had won every game here in 2023 – a run of 23 matches in all competitions. It is now over. One more victory and they would have equalled the record of an English top-flight club, set by Sunderland between 1890 and 1892. It was not to be. Erland Haaland scored their goal midway through the first half – of course he did. It meant he reached 50 in the Premier League from just 48 appearances, the fastest to the mark; Andy Cole had taken 65 games to get there. Haaland would almost pinch victory in the eighth and final minute of stoppage time, rising to meet a corner only to flick just wide and, in the end, it was a day when City let Liverpool off the hook. They were the better team, they created the bigger chances and the regrets belonged to them, not least when the referee, Chris Kavanagh, contentiously ruled that Manuel Akanji had fouled Alisson at a 68th-minute corner before Rúben Dias tapped home. It was a soft decision. Alexander-Arnold had said beforehand that Liverpool absolutely believed they could end City’s dominance and win the league. Now came the action to back it up. They were not at their swarming, marauding best and Jürgen Klopp would repeat his complaint about the 12.30pm kick-off after an international break. How was he supposed to prepare for the most difficult game of the season with one training session, he wanted to know. But his team found a way towards the end of a second half in which they had competed on a more equal footing, having got tighter to the sky blue shirts and the image of the afternoon was that of Alexander-Arnold shushing the City fans. He took a pass from Mohamed Salah to the right of goal and, with Bernardo Silva and Julián Álvarez slow to close down, he pulled the trigger in some style. Klopp would find himself ushering his striker Darwin Núñez away from the City manager, Pep Guardiola, at full time after the pair had clashed. It was nothing serious. More worrying for Klopp was the injury that forced Diogo Jota from the field and also the one Alisson felt at the very end. A feature of the early running had been Alisson’s discomfort on the ball. He dragged one clearance straight at Phil Foden and was fortunate the City winger shot straight at him. It was a mis-hit Alisson clearance that led to the City goal, the ball looping up and down on to Nathan Aké’s foot midway inside the Liverpool half, although there was still plenty for him to do. Aké did it, slaloming inside Alexander-Arnold and Dominik Szoboszlai before slipping a pass up to Haaland, who went into his muscle memory. One touch, then another, unload for the far corner. Alisson got a hand to it but he could only help it in. He beat the ground in frustration. He knew. City wanted to get at Alexander-Arnold through Jérémy Doku. It was clear from the first minute. With Akanji stepping into midfield from centre-half, Silva drifted towards the left, trying to create an overload to further examine the player who would finish as the Liverpool hero. It was certainly not easy for Alexander-Arnold in a defensive sense. Akanji was excellent, ditto Rodri while Silva showed off magical flicks and bursts. Some of City’s moves up and out from the back took the breath and they almost got a second goal before the interval. Álvarez, though, overcooked a cross for Haaland after a Doku break while Alisson snaked out a hand to push away a Foden shot. Klopp did not like Liverpool’s body language in the first half, when they were second best in too many areas. They did flicker, most obviously when Núñez directed a 15th-minute header goalwards from a Salah cross after an imperious run by Joël Matip. Ederson made a smart save. It was nearly but not quite throughout for Núñez. Szoboszlai also had a shot blocked by Dias in the 20th minute. The game could have been up for Liverpool when Doku blazed away from Alexis Mac Allister early in the second half to cut back for Álvarez; he lifted wastefully over. Or when Dias had the ball in the net after Alisson flapped at a corner. The pressure from Akanji was minimal but Kavanagh spared Alisson, ruling that it was enough to have put him off. Guardiola could be seen asking for more noise from the City support in the 70th minute – and not for the first time. The overall mood was soporific; maybe it was the early kick-off. Doku continued to bring the energy but City rather sleepwalked into the closing stages. Alexander-Arnold would provide the jolt."
Brentford,0,Arsenal,1,Kai Havertz springs to life and floors Brentford to send Arsenal top,https://www.theguardian.com/football/2023/nov/25/brentford-arsenal-premier-league-match-report,2023-11-25,"Whatever happens to Arsenal this season, Mikel Arteta will know this victory courtesy of substitute Kai Havertz’s late header could be priceless. A lacklustre display against a committed Brentford in which Aaron Ramsdale endured a shaky return between the posts looked like ending in disappointment as the game ticked towards the final whistle. But after a testing start to his career in north London since joining from Chelsea in the summer, Havertz ghosted in at the far post to steer home Bukayo Saka’s cross in the 89th minute. The win means Arteta’s side go top for the first time this season and the manager dragged Havertz over to celebrate with the away fans at the final whistle after a testing evening that had frayed the nerves of his goalkeeper in particular. With David Raya ineligible to face his parent club, Ramsdale could consider himself fortunate that a first appearance since the start of September in the Premier League somehow ended with a clean sheet after he almost gifted Brentford the lead in the first half. But the spirit that Arteta has built in 200 games as Arsenal manager was illustrated when the rest of the team ran to embrace their goalkeeper at the final whistle. “He showed great courage,” the Arsenal manager said of Ramsdale. “It’s a joy as a manager to see this reaction. Encouraging each other and showing love to each other – it doesn’t get any better than that. Today is my 200th game and I cannot be prouder of the team.” Manchester City’s draw against Liverpool had given Arsenal even more incentive to get a result, although Brentford had not been beaten here since losing to Arteta’s side in the EFL Cup nearly two months ago and are always a dangerous proposition on home turf. Arsenal also welcomed back Gabriel Jesus and Martin Ødegaard to their starting lineup for the first time in five weeks but it was Ramsdale who caught the eye in the opening exchanges and not for positive reasons. He sliced a clearance that sailed out of play just before an attempt to take a goal-kick with Gabriel Magalhães that almost ended in disaster. Yoane Wissa was quick to close him down and Ramsdale seemed to panic as the Brentford forward came near. The ball dropped into the path of Bryan Mbeumo, whose shot was brilliantly blocked on the line by Declan Rice. Much to Ramsdale’s relief, Wissa stabbed the rebound wide. “You’re just a shit David Raya,” sang the Brentford supporters in mocking delight. With Ødegaard employed in a deeper midfield role alongside Rice, Leandro Trossard was tasked with supporting Jesus through the middle and the Belgian mistimed a header that sailed over the crossbar from a corner. Brentford – who had the Ukrainian teenager Yehor Yarmoliuk making his full debut in midfield – also struggled to find a way through other than a Christian Nørgaard effort that sailed off target. Arsenal have been linked with a move for Ivan Toney in January when the England striker returns from his gambling ban, although it appears unlikely that Brentford would allow him to leave, with Mbeumo and Wissa both expected to be off to the Africa Cup of Nations. But Trossard showed just the kind of goalscoring instinct Arsenal require when he reacted first to Mark Flekken’s save from a Jesus header from point-blank range to head home. Sadly for him, VAR adjudged him to have been marginally in front of the ball and the goal was chalked off. Arteta’s mood would not have improved when Gabriel Martinelli curled a cross straight out of play at the start of the second half. Things could have got even worse for the Arsenal manager when Wissa’s clever flick played Mbeumo in behind the absent Oleksandr Zinchenko but the Cameroon forward dragged his shot wide of the near post. Eddie Nketiah came close to making an instant impression off the bench when he went up for Martinelli’s cross but a fantastic headed clearance from Ben Mee cleared the danger. Flekken then almost handed Arsenal the breakthrough when he dallied on the ball under pressure from Saka but the goalkeeper managed to keep his cool. It needed a brilliant goalline clearance from Zinchenko to prevent Neal Maupay scoring late on after the substitute met Mbeumo’s cross. “We went toe-to-toe with Arsenal for the whole match,” reflected Thomas Frank. But there was still time for Havertz to enliven a dull second half when he was picked out by Saka to leave Flekken floundering and send Arsenal top."
